{
  "schema_version": "cc-771.1",
  "document": {
    "source_filename": "2025_Annual_CAP_Report_FINAL_06-17-26_web.pdf",
    "source_sha256": "cc1eca34c15afc0fa6fd9d3ed3ccd96098e3ffd588287082d76abd9fa0a75a6e",
    "requested_model": "mistral-ocr-4-1",
    "returned_model": "mistral-ocr-4-1",
    "page_count": 4,
    "run_id": "2026-09-08-mistral-ocr-4-1-sandiego-2025-annotate-pages",
    "created_at": "2026-09-08T16:41:30+00:00"
  },
  "pages": [
    {
      "page_index": 5,
      "dimensions": {
        "width": 1022,
        "height": 621,
        "dpi": 73
      },
      "header": null,
      "footer": "50\nCity Planning\nThe City of San Diego 2035 Annual Climate Action Plan Report\n4",
      "markdown": "![img-0.jpeg](img-0.jpeg)\n\n# Annual Greenhouse Gas Emissions Levels in 2024\n\nAnnual GHG emissions levels were estimated to be 8.16 million metric tons of carbon dioxide equivalent (MMT CO₂e) in 2024.\n\nCitywide emissions in 2024 were down 23 percent from 2019, the reference point for measuring future changes in emissions in the Climate Action Plan. Citywide emissions in 2024 were also down 3 percent from the prior year, when emissions levels were down 20 percent from 2019.\n\nFigure 1. Citywide Greenhouse Gas Emissions and Reduction Targets\n\nEstimated citywide greenhouse gas emissions from 2019-2024 are shown alongside two trajectories through 2035: a Business-as-Usual scenario assuming no Climate Action Plan implementation and a linear trajectory of average emissions reductions each year from 2019 to the Climate Action Plan's 2030 and 2035 targets.\n\nSource: adapted from Table 3, Appendix B and \"City of San Diego Greenhouse Gas Emission Projections and Reductions\" (p.18), City of San Diego Climate Action Plan (2022).\n\nNotes: MMT CO₂e = million metric tons of carbon dioxide equivalent\n\nCitywide Greenhouse Gas Emissions Inventory\n\n![img-1.jpeg](img-1.jpeg)\n\n2019 Baseline in the Climate Action Plan\n\nBusiness as Usual Projection\n\nAnnual Emissions Reductions, 2019-2030 and 2031-2035 (for reference purposes only)\n\nClimate Action Plan Target Emissions Levels\n\nEstimated Annual Emissions Levels",
      "blocks": [
        {
          "block_id": "p5-b0",
          "page_index": 5,
          "reading_order_index": 0,
          "provider_type": "image",
          "cc_type": "image",
          "content": "![img-0.jpeg](img-0.jpeg)",
          "bbox_px": {
            "top_left_x": 0.0,
            "top_left_y": 0.0,
            "bottom_right_x": 1021.0,
            "bottom_right_y": 221.0
          },
          "bbox_norm": {
            "x0": 0.0,
            "y0": 0.0,
            "x1": 0.9990215264187867,
            "y1": 0.355877616747182
          },
          "confidence": null,
          "related_image_id": "img-0.jpeg",
          "related_table_id": null,
          "relationship_provenance": null
        },
        {
          "block_id": "p5-b1",
          "page_index": 5,
          "reading_order_index": 1,
          "provider_type": "title",
          "cc_type": "title",
          "content": "# Annual Greenhouse Gas Emissions Levels in 2024",
          "bbox_px": {
            "top_left_x": 50.0,
            "top_left_y": 254.0,
            "bottom_right_x": 320.0,
            "bottom_right_y": 341.0
          },
          "bbox_norm": {
            "x0": 0.04892367906066536,
            "y0": 0.40901771336553944,
            "x1": 0.3131115459882583,
            "y1": 0.5491143317230274
          },
          "confidence": null,
          "related_image_id": null,
          "related_table_id": null,
          "relationship_provenance": null
        },
        {
          "block_id": "p5-b2",
          "page_index": 5,
          "reading_order_index": 2,
          "provider_type": "text",
          "cc_type": "text",
          "content": "Annual GHG emissions levels were estimated to be 8.16 million metric tons of carbon dioxide equivalent (MMT CO₂e) in 2024.",
          "bbox_px": {
            "top_left_x": 51.0,
            "top_left_y": 353.0,
            "bottom_right_x": 303.0,
            "bottom_right_y": 402.0
          },
          "bbox_norm": {
            "x0": 0.049902152641878667,
            "y0": 0.5684380032206119,
            "x1": 0.2964774951076321,
            "y1": 0.6473429951690821
          },
          "confidence": null,
          "related_image_id": null,
          "related_table_id": null,
          "relationship_provenance": null
        },
        {
          "block_id": "p5-b3",
          "page_index": 5,
          "reading_order_index": 3,
          "provider_type": "text",
          "cc_type": "text",
          "content": "Citywide emissions in 2024 were down 23 percent from 2019, the reference point for measuring future changes in emissions in the Climate Action Plan. Citywide emissions in 2024 were also down 3 percent from the prior year, when emissions levels were down 20 percent from 2019.",
          "bbox_px": {
            "top_left_x": 51.0,
            "top_left_y": 409.0,
            "bottom_right_x": 316.0,
            "bottom_right_y": 506.0
          },
          "bbox_norm": {
            "x0": 0.049902152641878667,
            "y0": 0.6586151368760065,
            "x1": 0.30919765166340507,
            "y1": 0.8148148148148148
          },
          "confidence": null,
          "related_image_id": null,
          "related_table_id": null,
          "relationship_provenance": null
        },
        {
          "block_id": "p5-b4",
          "page_index": 5,
          "reading_order_index": 4,
          "provider_type": "caption",
          "cc_type": "caption",
          "content": "Figure 1. Citywide Greenhouse Gas Emissions and Reduction Targets",
          "bbox_px": {
            "top_left_x": 358.0,
            "top_left_y": 264.0,
            "bottom_right_x": 741.0,
            "bottom_right_y": 278.0
          },
          "bbox_norm": {
            "x0": 0.350293542074364,
            "y0": 0.4251207729468599,
            "x1": 0.7250489236790607,
            "y1": 0.4476650563607085
          },
          "confidence": null,
          "related_image_id": null,
          "related_table_id": null,
          "relationship_provenance": null
        },
        {
          "block_id": "p5-b5",
          "page_index": 5,
          "reading_order_index": 5,
          "provider_type": "text",
          "cc_type": "text",
          "content": "Estimated citywide greenhouse gas emissions from 2019-2024 are shown alongside two trajectories through 2035: a Business-as-Usual scenario assuming no Climate Action Plan implementation and a linear trajectory of average emissions reductions each year from 2019 to the Climate Action Plan's 2030 and 2035 targets.",
          "bbox_px": {
            "top_left_x": 358.0,
            "top_left_y": 287.0,
            "bottom_right_x": 505.0,
            "bottom_right_y": 416.0
          },
          "bbox_norm": {
            "x0": 0.350293542074364,
            "y0": 0.46215780998389694,
            "x1": 0.49412915851272016,
            "y1": 0.6698872785829307
          },
          "confidence": null,
          "related_image_id": null,
          "related_table_id": null,
          "relationship_provenance": null
        },
        {
          "block_id": "p5-b6",
          "page_index": 5,
          "reading_order_index": 6,
          "provider_type": "text",
          "cc_type": "text",
          "content": "Source: adapted from Table 3, Appendix B and \"City of San Diego Greenhouse Gas Emission Projections and Reductions\" (p.18), City of San Diego Climate Action Plan (2022).",
          "bbox_px": {
            "top_left_x": 358.0,
            "top_left_y": 444.0,
            "bottom_right_x": 509.0,
            "bottom_right_y": 507.0
          },
          "bbox_norm": {
            "x0": 0.350293542074364,
            "y0": 0.714975845410628,
            "x1": 0.4980430528375734,
            "y1": 0.8164251207729468
          },
          "confidence": null,
          "related_image_id": null,
          "related_table_id": null,
          "relationship_provenance": null
        },
        {
          "block_id": "p5-b7",
          "page_index": 5,
          "reading_order_index": 7,
          "provider_type": "text",
          "cc_type": "text",
          "content": "Notes: MMT CO₂e = million metric tons of carbon dioxide equivalent",
          "bbox_px": {
            "top_left_x": 358.0,
            "top_left_y": 510.0,
            "bottom_right_x": 505.0,
            "bottom_right_y": 535.0
          },
          "bbox_norm": {
            "x0": 0.350293542074364,
            "y0": 0.821256038647343,
            "x1": 0.49412915851272016,
            "y1": 0.8615136876006442
          },
          "confidence": null,
          "related_image_id": null,
          "related_table_id": null,
          "relationship_provenance": null
        },
        {
          "block_id": "p5-b8",
          "page_index": 5,
          "reading_order_index": 8,
          "provider_type": "caption",
          "cc_type": "caption",
          "content": "Citywide Greenhouse Gas Emissions Inventory",
          "bbox_px": {
            "top_left_x": 544.0,
            "top_left_y": 295.0,
            "bottom_right_x": 850.0,
            "bottom_right_y": 314.0
          },
          "bbox_norm": {
            "x0": 0.5322896281800391,
            "y0": 0.4750402576489533,
            "x1": 0.8317025440313112,
            "y1": 0.5056360708534622
          },
          "confidence": null,
          "related_image_id": null,
          "related_table_id": null,
          "relationship_provenance": "derived"
        },
        {
          "block_id": "p5-b9",
          "page_index": 5,
          "reading_order_index": 9,
          "provider_type": "image",
          "cc_type": "image",
          "content": "![img-1.jpeg](img-1.jpeg)",
          "bbox_px": {
            "top_left_x": 528.0,